{
  "$schema": "http://json-schema.org/draft-07/schema#",
  "title": "Skill Output Schema",
  "description": "Schema for skill output - customize for your skill",
  "type": "object",
  "required": ["skill_name", "client_id", "timestamp", "data"],
  "properties": {
    "skill_name": {
      "type": "string",
      "description": "Name of the skill that generated this output"
    },
    "client_id": {
      "type": "string",
      "description": "Client identifier"
    },
    "timestamp": {
      "type": "string",
      "format": "date-time",
      "description": "ISO 8601 timestamp of generation"
    },
    "version": {
      "type": "string",
      "description": "Skill version that generated this output"
    },
    "data": {
      "type": "object",
      "description": "Primary output data - customize this section",
      "properties": {
        "items": {
          "type": "array",
          "items": {
            "type": "object",
            "properties": {
              "id": { "type": "string" },
              "content": { "type": "string" },
              "score": { "type": "number", "minimum": 0, "maximum": 1 },
              "metadata": { "type": "object" }
            }
          }
        },
        "summary": {
          "type": "object",
          "properties": {
            "total_items": { "type": "integer" },
            "processed_items": { "type": "integer" },
            "quality_score": { "type": "number" }
          }
        }
      }
    },
    "metadata": {
      "type": "object",
      "description": "Execution metadata",
      "properties": {
        "execution_time_ms": { "type": "integer" },
        "stages_completed": { "type": "array", "items": { "type": "string" } },
        "model_calls": { "type": "integer" },
        "tokens_used": { "type": "integer" },
        "checkpoints": { "type": "array", "items": { "type": "string" } },
        "warnings": { "type": "array", "items": { "type": "string" } }
      }
    },
    "quality_gates": {
      "type": "object",
      "description": "Quality gate results",
      "properties": {
        "schema_valid": { "type": "boolean" },
        "completeness_score": { "type": "number" },
        "factuality_score": { "type": "number" },
        "all_passed": { "type": "boolean" }
      }
    }
  }
}
